{"$id":"urn:lima:v4:lima.artifact-envelope","$schema":"https://json-schema.org/draft/2020-12/schema","additionalProperties":false,"properties":{"artifact_id":{"pattern":"^[A-Za-z0-9][A-Za-z0-9._:-]{0,127}$","type":"string"},"blob_ref":{"type":"object"},"classification":{"enum":["public","internal","sensitive","restricted"],"type":"string"},"content_digest":{"pattern":"^[0-9a-f]{64}$","type":"string"},"coverage_gaps":{"items":{"type":"string"},"maxItems":256,"type":"array"},"created_at":{"pattern":"^\\d{4}-\\d{2}-\\d{2}T\\d{2}:\\d{2}:\\d{2}(\\.\\d{1,6})?(Z|[+-]\\d{2}:\\d{2})$","type":"string"},"lineage":{"items":{"type":"object"},"maxItems":128,"type":"array"},"payload":{"type":"object"},"policy_digest":{"pattern":"^[0-9a-f]{64}$","type":"string"},"producer":{"pattern":"^[A-Za-z0-9][A-Za-z0-9._:-]{0,127}$","type":"string"},"repository_snapshot_digest":{"pattern":"^[0-9a-f]{64}$","type":"string"},"retention_class":{"enum":["ephemeral","standard","audit","legal_hold"],"type":"string"},"schema_name":{"pattern":"^[a-z][a-z0-9]*(?:[._-][a-z0-9]+)*$","type":"string"},"schema_version":{"pattern":"^4\\.[0-9]+$","type":"string"},"stage_attempt_id":{"pattern":"^[A-Za-z0-9][A-Za-z0-9._:-]{0,127}$","type":"string"},"supersedes":{"type":["object","null"]},"task_id":{"pattern":"^[A-Za-z0-9][A-Za-z0-9._:-]{0,127}$","type":"string"},"tenant_id":{"pattern":"^[A-Za-z0-9][A-Za-z0-9._:-]{0,127}$","type":"string"},"toolchain_digest":{"pattern":"^[0-9a-f]{64}$","type":"string"},"workflow_id":{"pattern":"^[A-Za-z0-9][A-Za-z0-9._:-]{0,127}$","type":"string"}},"required":["schema_name","schema_version","artifact_id","tenant_id","task_id","workflow_id","stage_attempt_id","repository_snapshot_digest","producer","created_at","policy_digest","toolchain_digest","content_digest","classification","retention_class","lineage","supersedes","coverage_gaps"],"title":"lima.artifact-envelope","type":"object"}