{"artifact_id":"artifact-contract-foundation-0001","classification":"internal","content_digest":"567791dedb5a4052163ab8fcc5e7abc3ff71008fa1ec690c8fa739dfe14822d7","coverage_gaps":[],"created_at":"2026-09-01T00:00:00.000000Z","lineage":[],"payload":{"coverage":{"files":3},"kind":"contract-foundation"},"policy_digest":"2222222222222222222222222222222222222222222222222222222222222222","producer":"lima.contracts.tests","repository_snapshot_digest":"1111111111111111111111111111111111111111111111111111111111111111","retention_class":"standard","schema_name":"lima.contract_foundation_fixture","schema_version":"4.0","stage_attempt_id":"stage-attempt-test","supersedes":null,"task_id":"task-test","tenant_id":"tenant-test","toolchain_digest":"3333333333333333333333333333333333333333333333333333333333333333","workflow_id":"workflow-test"}